[
  {
    "name": "p5.layers",
    "description": "Make it easier to use Graphics instances to make layers",
    "homepage": "https://osteele.github.io/p5.libs/p5.layers/",
    "packageName": "p5.layers",
    "defines": {
      "globals": ["beginLayer"]
    }
  },
  {
    "name": "p5.rotate-about",
    "description": "Add `rotateAbout()` and `scaleAbout()` functions to p5.js",
    "homepage": "https://osteele.github.io/p5.libs/p5.rotate-about/",
    "packageName": "p5.rotate-about",
    "defines": {
      "globals": ["rotateAbout", "scaleAbout"]
    }
  },
  {
    "name": "p5.vector-arguments",
    "description": "Modify the p5.js functions to accept Vector arguments",
    "homepage": "https://osteele.github.io/p5.libs/p5.vector-arguments/",
    "packageName": "p5.vector-arguments",
    "defines": {
      "globals": ["enableVectorArguments"]
    }
  }
]
